<?xml version="1.0" encoding="UTF-8"?>
<konyvtari-nyilvantartas xmlns:xsi="http://www.w3.org/2001/XMLSchema-instance"
                         xsi:noNamespaceSchemaLocation="8.c.xsd">
  <konyv isbn="i963-9131-71-7">
    <szerzo>Bradley, Neil</szerzo>
    <cim>Az XML-kézikönyv</cim>
    <evszam>2005</evszam>
    <terjedelem>758</terjedelem>
    <targyszavak>
      <targyszo>számítógépes hálózat</targyszo>
      <targyszo>Internet</targyszo>
      <targyszo>programozási nyelvek</targyszo>
      <targyszo>XML</targyszo>
    </targyszavak>
  </konyv>
</konyvtari-nyilvantartas>